{
  "id": "prog_005",
  "title": "Полная гибкость",
  "description": "Двенадцатинедельная комплексная программа для развития гибкости всего тела. Это самая полная программа, которая включает работу со всеми группами мышц и суставов: ноги, спина, плечи, тазобедренные суставы. Программа построена по принципу прогрессивной нагрузки - от базовых растяжек до продвинутых асан на гибкость. Подходит для тех, кто хочет достичь максимальной гибкости тела.",
  "short_description": "12 недель комплексного развития гибкости всего тела",
  "duration_weeks": 12,
  "lessons": [
    "013",
    "014",
    "015",
    "016",
    "017",
    "018",
    "019",
    "020",
    "021",
    "022"
  ],
  "schedule": [
    {
      "day": 1,
      "lesson_id": "013",
      "note": "Неделя 1-2: Базовый уровень"
    },
    {
      "day": 3,
      "lesson_id": "014"
    },
    {
      "day": 5,
      "lesson_id": "015"
    },
    {
      "day": 8,
      "lesson_id": "013"
    },
    {
      "day": 10,
      "lesson_id": "014"
    },
    {
      "day": 12,
      "lesson_id": "015"
    },
    {
      "day": 15,
      "lesson_id": "016",
      "note": "Неделя 3-4: Средний уровень"
    },
    {
      "day": 17,
      "lesson_id": "014"
    },
    {
      "day": 19,
      "lesson_id": "016"
    },
    {
      "day": 22,
      "lesson_id": "017"
    },
    {
      "day": 24,
      "lesson_id": "016"
    },
    {
      "day": 26,
      "lesson_id": "017"
    },
    {
      "day": 29,
      "lesson_id": "018",
      "note": "Неделя 5-6: Продолжаем средний уровень"
    },
    {
      "day": 31,
      "lesson_id": "017"
    },
    {
      "day": 33,
      "lesson_id": "018"
    },
    {
      "day": 36,
      "lesson_id": "019"
    },
    {
      "day": 38,
      "lesson_id": "018"
    },
    {
      "day": 40,
      "lesson_id": "019"
    },
    {
      "day": 43,
      "lesson_id": "020",
      "note": "Неделя 7-8: Продвинутый уровень - шпагаты"
    },
    {
      "day": 45,
      "lesson_id": "019"
    },
    {
      "day": 47,
      "lesson_id": "020"
    },
    {
      "day": 50,
      "lesson_id": "021"
    },
    {
      "day": 52,
      "lesson_id": "020"
    },
    {
      "day": 54,
      "lesson_id": "021"
    },
    {
      "day": 57,
      "lesson_id": "022",
      "note": "Неделя 9-10: Продвинутые асаны"
    },
    {
      "day": 59,
      "lesson_id": "021"
    },
    {
      "day": 61,
      "lesson_id": "022"
    },
    {
      "day": 64,
      "lesson_id": "020"
    },
    {
      "day": 66,
      "lesson_id": "021"
    },
    {
      "day": 68,
      "lesson_id": "022"
    },
    {
      "day": 71,
      "lesson_id": "022",
      "note": "Неделя 11-12: Закрепление и мастерство"
    },
    {
      "day": 73,
      "lesson_id": "020"
    },
    {
      "day": 75,
      "lesson_id": "021"
    },
    {
      "day": 78,
      "lesson_id": "022"
    },
    {
      "day": 80,
      "lesson_id": "020"
    },
    {
      "day": 82,
      "lesson_id": "021"
    },
    {
      "day": 84,
      "lesson_id": "022",
      "note": "Финальная практика - вы достигли полной гибкости!"
    }
  ],
  "goal": "Достичь максимальной гибкости всего тела, освоить шпагаты и продвинутые асаны",
  "level": 2,
  "thumbnail_url": "content/programs/full_flexibility/thumbnail.jpg",
  "category": "flexibility",
  "benefits": [
    "Комплексное развитие гибкости всего тела",
    "Достижение продольного и поперечного шпагата",
    "Освоение продвинутых асан на гибкость",
    "Раскрытие плечевого пояса",
    "Улучшение подвижности всех суставов",
    "Профилактика травм",
    "Улучшение осанки и координации"
  ],
  "requirements": [
    "Готовность к регулярным занятиям (3 раза в неделю минимум)",
    "Нет травм суставов и позвоночника",
    "Базовый уровень физической подготовки",
    "Коврик для йоги",
    "30-40 минут на практику",
    "Терпение и последовательность"
  ],
  "frequency": "3-4 раза в неделю",
  "total_duration_minutes": 1155,
  "is_premium": true,
  "created_at": "2026-02-28",
  "updated_at": "2026-02-28",
  "order": 5
}
