{
  "id": "prog_004",
  "title": "Антистресс",
  "description": "Двухнедельная программа для глубокого расслабления, снятия стресса и улучшения качества сна. Программа сочетает медитативные практики, дыхательные техники и релаксационные асаны. Идеально подходит для людей с высоким уровнем стресса, проблемами со сном и хронической усталостью. Практики можно выполнять в любое время дня, особенно эффективны вечером перед сном.",
  "short_description": "14 дней медитации и релаксации для снятия стресса",
  "duration_weeks": 2,
  "lessons": [
    "031",
    "032",
    "033",
    "036",
    "037",
    "038"
  ],
  "schedule": [
    {
      "day": 1,
      "lesson_id": "031",
      "note": "Знакомство с медитацией"
    },
    {
      "day": 2,
      "lesson_id": "032",
      "note": "Дыхательные практики для успокоения"
    },
    {
      "day": 3,
      "lesson_id": "037",
      "note": "Снятие стресса"
    },
    {
      "day": 4,
      "lesson_id": "033",
      "note": "Медитация на осознанность"
    },
    {
      "day": 5,
      "lesson_id": "038",
      "note": "Вечерняя релаксация"
    },
    {
      "day": 6,
      "lesson_id": "032",
      "note": "Дыхательные практики"
    },
    {
      "day": 7,
      "lesson_id": "036",
      "note": "Йога-нидра для глубокого расслабления"
    },
    {
      "day": 8,
      "lesson_id": "031",
      "note": "Неделя 2: Медитация"
    },
    {
      "day": 9,
      "lesson_id": "033",
      "note": "Медитация на осознанность"
    },
    {
      "day": 10,
      "lesson_id": "037",
      "note": "Снятие стресса"
    },
    {
      "day": 11,
      "lesson_id": "032",
      "note": "Дыхательные практики"
    },
    {
      "day": 12,
      "lesson_id": "038",
      "note": "Вечерняя релаксация"
    },
    {
      "day": 13,
      "lesson_id": "033",
      "note": "Медитация на осознанность"
    },
    {
      "day": 14,
      "lesson_id": "036",
      "note": "Финальная йога-нидра - полное расслабление"
    }
  ],
  "goal": "Снизить уровень стресса, улучшить качество сна, научиться техникам быстрого расслабления",
  "level": 1,
  "thumbnail_url": "content/programs/antistress/thumbnail.jpg",
  "category": "meditation",
  "benefits": [
    "Значительное снижение уровня стресса",
    "Улучшение качества сна",
    "Освоение техник быстрого расслабления",
    "Повышение стрессоустойчивости",
    "Улучшение концентрации внимания",
    "Снижение тревожности"
  ],
  "requirements": [
    "Тихое место для практики",
    "Возможность не отвлекаться 10-25 минут",
    "Коврик или удобное место для сидения/лежания",
    "Наушники (опционально)"
  ],
  "frequency": "Ежедневно или 5-6 раз в неделю",
  "total_duration_minutes": 245,
  "is_premium": false,
  "created_at": "2026-02-28",
  "updated_at": "2026-02-28",
  "order": 4
}
