{
  "id": "prog_002",
  "title": "Путь к шпагату",
  "description": "Восьминедельная программа для достижения продольного и поперечного шпагата. Программа разработана с учётом физиологии растяжки и включает подготовительные упражнения, работу с тазобедренными суставами и постепенное углубление в шпагаты. Каждая неделя приближает вас к цели через безопасную и эффективную растяжку. Подходит для любого уровня подготовки.",
  "short_description": "8 недель до шпагата - безопасно и эффективно",
  "duration_weeks": 8,
  "lessons": [
    "013",
    "014",
    "016",
    "017",
    "020",
    "021"
  ],
  "schedule": [
    {
      "day": 1,
      "lesson_id": "013",
      "note": "Неделя 1: Базовая растяжка всего тела"
    },
    {
      "day": 3,
      "lesson_id": "014",
      "note": "Гибкость ног и спины"
    },
    {
      "day": 5,
      "lesson_id": "013",
      "note": "Повторяем базовую растяжку"
    },
    {
      "day": 8,
      "lesson_id": "014",
      "note": "Неделя 2: Продолжаем работу с гибкостью"
    },
    {
      "day": 10,
      "lesson_id": "016",
      "note": "Переходим к глубокой растяжке ног"
    },
    {
      "day": 12,
      "lesson_id": "013",
      "note": "Базовая растяжка для восстановления"
    },
    {
      "day": 15,
      "lesson_id": "016",
      "note": "Неделя 3: Глубокая растяжка ног"
    },
    {
      "day": 17,
      "lesson_id": "014",
      "note": "Гибкость ног и спины"
    },
    {
      "day": 19,
      "lesson_id": "016",
      "note": "Глубокая растяжка"
    },
    {
      "day": 22,
      "lesson_id": "017",
      "note": "Неделя 4: Начинаем подготовку к шпагатам"
    },
    {
      "day": 24,
      "lesson_id": "016",
      "note": "Глубокая растяжка ног"
    },
    {
      "day": 26,
      "lesson_id": "017",
      "note": "Шпагаты - подготовка"
    },
    {
      "day": 29,
      "lesson_id": "017",
      "note": "Неделя 5: Интенсивная подготовка к шпагатам"
    },
    {
      "day": 31,
      "lesson_id": "016",
      "note": "Глубокая растяжка"
    },
    {
      "day": 33,
      "lesson_id": "017",
      "note": "Шпагаты - подготовка"
    },
    {
      "day": 36,
      "lesson_id": "020",
      "note": "Неделя 6: Продольный шпагат"
    },
    {
      "day": 38,
      "lesson_id": "017",
      "note": "Подготовка к шпагатам"
    },
    {
      "day": 40,
      "lesson_id": "020",
      "note": "Продольный шпагат"
    },
    {
      "day": 43,
      "lesson_id": "021",
      "note": "Неделя 7: Поперечный шпагат"
    },
    {
      "day": 45,
      "lesson_id": "020",
      "note": "Продольный шпагат"
    },
    {
      "day": 47,
      "lesson_id": "021",
      "note": "Поперечный шпагат"
    },
    {
      "day": 50,
      "lesson_id": "020",
      "note": "Неделя 8: Закрепление результата"
    },
    {
      "day": 52,
      "lesson_id": "021",
      "note": "Поперечный шпагат"
    },
    {
      "day": 54,
      "lesson_id": "020",
      "note": "Продольный шпагат"
    },
    {
      "day": 56,
      "lesson_id": "021",
      "note": "Финальная практика - поперечный шпагат. Вы достигли цели!"
    }
  ],
  "goal": "Сесть на продольный и поперечный шпагат безопасным и эффективным способом",
  "level": 2,
  "thumbnail_url": "content/programs/splits_journey/thumbnail.jpg",
  "category": "flexibility",
  "benefits": [
    "Достижение продольного шпагата",
    "Достижение поперечного шпагата",
    "Значительное улучшение гибкости ног",
    "Раскрытие тазобедренных суставов",
    "Улучшение кровообращения в ногах",
    "Профилактика травм при других видах спорта"
  ],
  "requirements": [
    "Базовый уровень гибкости",
    "Нет травм тазобедренных суставов",
    "Нет проблем с коленями",
    "Регулярность занятий (минимум 3 раза в неделю)",
    "Коврик для йоги",
    "30-40 минут на практику"
  ],
  "frequency": "3-4 раза в неделю",
  "total_duration_minutes": 750,
  "is_premium": true,
  "created_at": "2026-02-28",
  "updated_at": "2026-02-28",
  "order": 2
}
