{
  "id": "prog_003",
  "title": "Раскрытие тазобедренных суставов",
  "description": "Шестинедельная программа для глубокой работы с тазобедренными суставами. Тазобедренные суставы - одна из самых закрепощённых зон у современного человека из-за сидячего образа жизни. Эта программа поможет вернуть подвижность, снять зажимы и подготовить тело к сложным асанам, включая лотос. Программа включает мягкие раскрывающие практики и постепенное углубление.",
  "short_description": "6 недель для раскрытия таза и подготовки к лотосу",
  "duration_weeks": 6,
  "lessons": [
    "023",
    "024",
    "025",
    "026",
    "027",
    "028"
  ],
  "schedule": [
    {
      "day": 1,
      "lesson_id": "023",
      "note": "Неделя 1: Базовое раскрытие таза"
    },
    {
      "day": 3,
      "lesson_id": "024",
      "note": "Мягкая работа с тазом"
    },
    {
      "day": 5,
      "lesson_id": "025",
      "note": "Снятие зажимов в тазу"
    },
    {
      "day": 8,
      "lesson_id": "023",
      "note": "Неделя 2: Закрепление базы"
    },
    {
      "day": 10,
      "lesson_id": "024",
      "note": "Мягкая работа с тазом"
    },
    {
      "day": 12,
      "lesson_id": "025",
      "note": "Снятие зажимов"
    },
    {
      "day": 15,
      "lesson_id": "026",
      "note": "Неделя 3: Глубокое раскрытие таза"
    },
    {
      "day": 17,
      "lesson_id": "024",
      "note": "Мягкая работа"
    },
    {
      "day": 19,
      "lesson_id": "026",
      "note": "Глубокое раскрытие"
    },
    {
      "day": 22,
      "lesson_id": "027",
      "note": "Неделя 4: Подготовка к лотосу"
    },
    {
      "day": 24,
      "lesson_id": "026",
      "note": "Глубокое раскрытие таза"
    },
    {
      "day": 26,
      "lesson_id": "027",
      "note": "Лотос - подготовка"
    },
    {
      "day": 29,
      "lesson_id": "028",
      "note": "Неделя 5: Асаны для подвижности таза"
    },
    {
      "day": 31,
      "lesson_id": "027",
      "note": "Лотос - подготовка"
    },
    {
      "day": 33,
      "lesson_id": "028",
      "note": "Асаны для подвижности"
    },
    {
      "day": 36,
      "lesson_id": "026",
      "note": "Неделя 6: Закрепление результата"
    },
    {
      "day": 38,
      "lesson_id": "027",
      "note": "Лотос - подготовка"
    },
    {
      "day": 40,
      "lesson_id": "028",
      "note": "Асаны для подвижности"
    },
    {
      "day": 42,
      "lesson_id": "028",
      "note": "Финальная практика - полное раскрытие таза!"
    }
  ],
  "goal": "Раскрыть тазобедренные суставы, снять зажимы, подготовиться к позе лотоса",
  "level": 2,
  "thumbnail_url": "content/programs/hip_opening/thumbnail.jpg",
  "category": "hip_joints",
  "benefits": [
    "Значительное улучшение подвижности таза",
    "Снятие хронических зажимов",
    "Подготовка к позе лотоса",
    "Улучшение кровообращения в области таза",
    "Профилактика проблем с тазобедренными суставами",
    "Снятие напряжения от сидячей работы"
  ],
  "requirements": [
    "Нет травм тазобедренных суставов",
    "Нет проблем с коленями",
    "Базовый уровень гибкости",
    "Коврик для йоги",
    "25-35 минут на практику"
  ],
  "frequency": "3 раза в неделю",
  "total_duration_minutes": 540,
  "is_premium": true,
  "created_at": "2026-02-28",
  "updated_at": "2026-02-28",
  "order": 3
}
